{
  "$schema": "../../packages/content/schemas/module.schema.json",
  "schema_version": "1.0",
  "module_id": "A1_PastSimple_01",
  "version": 1,
  "cefr_level": "A1",
  "title": {
    "en": "Tales of Yesterday",
    "ru": "Сказания о вчерашнем дне"
  },
  "skill": "grammar",
  "grammar_topic": "Past Simple",
  "prerequisites": [
    "A1_VerbToBe_01"
  ],
  "concepts": [
    {
      "concept_id": "past_simple.regular_ed",
      "label": "Regular verbs: -ed"
    },
    {
      "concept_id": "past_simple.irregular",
      "label": "Irregular verbs"
    },
    {
      "concept_id": "past_simple.did_not",
      "label": "Negative: didn't + V1"
    }
  ],
  "vocabulary_set": "vocab_A1_castle_life",
  "mastery": {
    "boss_task_count": 10,
    "pass_score": 0.8
  },
  "tasks": [
    "A1_PastSimple_01_q1",
    "A1_PastSimple_01_q2",
    "A1_PastSimple_01_q3",
    "A1_PastSimple_01_q4",
    "A1_PastSimple_01_q5",
    "A1_PastSimple_01_q6",
    "A1_PastSimple_01_q7",
    "A1_PastSimple_01_q8",
    "A1_PastSimple_01_q9",
    "A1_PastSimple_01_q10",
    "A1_PastSimple_01_q11",
    "A1_PastSimple_01_q12"
  ]
}
