{
  "$schema": "../../packages/content/schemas/module.schema.json",
  "schema_version": "1.0",
  "module_id": "A1_Articles_01",
  "version": 1,
  "cefr_level": "A1",
  "title": {
    "en": "The Lost Scrolls",
    "ru": "Потерянные свитки"
  },
  "skill": "grammar",
  "grammar_topic": "Articles",
  "prerequisites": [
    "A1_VerbToBe_01"
  ],
  "concepts": [
    {
      "concept_id": "articles.a_an",
      "label": "a / an: first mention, sound rule"
    },
    {
      "concept_id": "articles.the_known",
      "label": "the: known or unique things"
    },
    {
      "concept_id": "articles.zero",
      "label": "No article: plurals and things in general"
    }
  ],
  "mastery": {
    "boss_task_count": 8,
    "pass_score": 0.8
  },
  "tasks": [
    "A1_Articles_01_q1",
    "A1_Articles_01_q2",
    "A1_Articles_01_q3",
    "A1_Articles_01_q4",
    "A1_Articles_01_q5",
    "A1_Articles_01_q6",
    "A1_Articles_01_q7",
    "A1_Articles_01_q8",
    "A1_Articles_01_q9",
    "A1_Articles_01_q10",
    "A1_Articles_01_q11",
    "A1_Articles_01_q12"
  ]
}
