{
  "$schema": "../../packages/content/schemas/module.schema.json",
  "schema_version": "1.0",
  "module_id": "A1_VerbToBe_01",
  "version": 1,
  "cefr_level": "A1",
  "title": {
    "en": "Words at the Gate",
    "ru": "Слова у врат"
  },
  "skill": "grammar",
  "grammar_topic": "Verb to be",
  "prerequisites": [],
  "concepts": [
    {
      "concept_id": "verb_to_be.present_forms",
      "label": "am / is / are"
    },
    {
      "concept_id": "verb_to_be.negative",
      "label": "Negative: am not / isn't / aren't"
    },
    {
      "concept_id": "verb_to_be.questions",
      "label": "Questions: Am I…? Is he…? Are you…?"
    }
  ],
  "mastery": {
    "boss_task_count": 8,
    "pass_score": 0.8
  },
  "tasks": [
    "A1_VerbToBe_01_q1",
    "A1_VerbToBe_01_q2",
    "A1_VerbToBe_01_q3",
    "A1_VerbToBe_01_q4",
    "A1_VerbToBe_01_q5",
    "A1_VerbToBe_01_q6",
    "A1_VerbToBe_01_q7",
    "A1_VerbToBe_01_q8",
    "A1_VerbToBe_01_q9",
    "A1_VerbToBe_01_q10",
    "A1_VerbToBe_01_q11",
    "A1_VerbToBe_01_q12"
  ]
}
